{
  "b0_version": "v0.1",
  "timestamp": "2026-03-12T06:07:32.583558+00:00",
  "loaded_files": [
    "/SOT.md",
    "/CODEBASE.md",
    "/agent/POLICY.md",
    "/spec/AcceptanceTests.md",
    "/spec/Baseline.md",
    "/spec/ADRs/ADR-0000-template.md",
    "/spec/Contracts/BootManifest.schema.json",
    "/spec/Contracts/WIH.schema.json",
    "/spec/Contracts/Graph.schema.json",
    "/spec/Contracts/ToolRegistry.schema.json",
    "/spec/Contracts/ToolDefinition.schema.json",
    "/spec/Contracts/Receipt.schema.json",
    "/spec/Contracts/RunState.schema.json",
    "/spec/Contracts/BeadsGraph.schema.json",
    "/spec/Contracts/BeadsNode.schema.json",
    "/spec/Contracts/BeadsRunState.schema.json",
    "/tools/tool_registry.json",
    "/spec/Deltas/0003-repo-cartography-ci.md",
    "/spec/Deltas/0007-opencode-tui-fork.md",
    "/spec/Deltas/0005-capsule-runtime-mcp-host.md",
    "/spec/Deltas/0004-contract-root-security-receipts.md",
    "/spec/Deltas/0006-task-parity-runstate.md",
    "/spec/Deltas/0002-memory-promotion.md",
    "/spec/Deltas/0001-task-engine.md",
    "/.allternit/graphs/graph-code-mode.json",
    "/.allternit/graphs/graph-summit-mvp.json",
    "/.allternit/wih/T0005.wih.json",
    "/.allternit/wih/T0004.wih.json",
    "/.allternit/wih/CM-UI023.wih.json",
    "/.allternit/wih/CM-UI022.wih.json",
    "/.allternit/wih/CM-K002.wih.json",
    "/.allternit/wih/CM-K003.wih.json",
    "/.allternit/wih/T0012.wih.json",
    "/.allternit/wih/T0013.wih.json",
    "/.allternit/wih/T0018.wih.json",
    "/.allternit/wih/CM-UI001.wih.json",
    "/.allternit/wih/CM-UI032.wih.json",
    "/.allternit/wih/CM-K050.wih.json",
    "/.allternit/wih/CM-UI024.wih.json",
    "/.allternit/wih/CM-K031.wih.json",
    "/.allternit/wih/CM-UI010.wih.json",
    "/.allternit/wih/CM-UI011.wih.json",
    "/.allternit/wih/CM-UI003.wih.json",
    "/.allternit/wih/CM-UI002.wih.json",
    "/.allternit/wih/CM-UI040.wih.json",
    "/.allternit/wih/CM-UI041.wih.json",
    "/.allternit/wih/CM-K061.wih.json",
    "/.allternit/wih/CM-K060.wih.json",
    "/.allternit/wih/CM-UI020.wih.json",
    "/.allternit/wih/CM-UI021.wih.json",
    "/.allternit/wih/CM-K001.wih.json",
    "/.allternit/wih/CM-UI051.wih.json",
    "/.allternit/wih/CM-UI030.wih.json"
  ],
  "hashes": {
    "/.allternit/wih/CM-UI041.wih.json": "47df4d8194b4d240676c59854188285fe8c3b9c3e4e0152fd2d1b750d76d8058",
    "/spec/AcceptanceTests.md": "ce062bddce87d4a8091e135d293684d335e6902f07dad89efa44d9cdbb00eb97",
    "/.allternit/wih/CM-K003.wih.json": "d34f8f8d9974ed837587b29cac9e416ddc66491346a2a088054d5b7f7e444cb1",
    "/.allternit/wih/CM-K061.wih.json": "5a73a4dc3b8ec0f99693ed3159f03273e852405b5646590ce437f7c25c2a0bd9",
    "/SOT.md": "9b6873c0755f3a6f94b76e04f2dc32a7ef4bcc675affabda337c0d35548678fb",
    "/spec/Deltas/0005-capsule-runtime-mcp-host.md": "973841c2c98df2e516687f4d88f2bf957573284bdd216118b6d3e74965728fc2",
    "/.allternit/wih/CM-K002.wih.json": "66c1b9af0927032e9d16c7d15cfeb5f6d9dd93bd6507ceda8dd0a2f348736ecc",
    "/.allternit/wih/CM-UI030.wih.json": "d8e9a9fe6f0b9e612c5afe68cbfd07fc9f8eb1d7491bf063292cfb7f59f35972",
    "/.allternit/wih/T0005.wih.json": "1151e380f2ab1c17d6cae4a71ba61e054040df436e6763177f4da5737b21a46c",
    "/spec/Contracts/BeadsNode.schema.json": "6408db08a2e7fd287f9770aca6a3ceef267933f88b5451386fa3ca6089f95da4",
    "/.allternit/wih/CM-UI032.wih.json": "c96ab82ad7daa5d82b5affceb6bcb293e5f7571f590df034df593617d744eec6",
    "/.allternit/wih/CM-UI010.wih.json": "03d1258a093eb898457365750c9dfa4bb36fac4955dea1882467ca0e13ea2bc0",
    "/.allternit/wih/CM-K060.wih.json": "75b142927e937197a99b3575f368d0d21f4b5fd6a2179af2d72dd7a1c6d900db",
    "/spec/Deltas/0003-repo-cartography-ci.md": "cf2172c089f6e723f495ebb05aa79c162eecad38f492111f5d2ad7bc511fc3c7",
    "/spec/Contracts/RunState.schema.json": "1f516c1c955b4969d247e35c11d3b5d783a41d09bf5505577b7ccc767a1b48c4",
    "/spec/Contracts/ToolDefinition.schema.json": "e5695137c6fc9af75a7acfae37ffad86eda1779be3816af2283058548ebef32a",
    "/spec/Contracts/BootManifest.schema.json": "b2687e87cd698040f77f150b37626fbf49e56745bfaf1b3b80bf97b68410a805",
    "/spec/Deltas/0002-memory-promotion.md": "c2c24608d7e1b6821cc12652633962c908e590a563c719c69241d1dd4a7f4afa",
    "/spec/Deltas/0001-task-engine.md": "3f625265889a130692205e4f273dc823a4b99a02da76b35563a1bc396953431b",
    "/.allternit/wih/T0004.wih.json": "809dfe10c4c70f48eb9ecb1ab6152543b4de66bf3d7547161f6c6f86c5b212e2",
    "/.allternit/wih/T0018.wih.json": "da8f57a0832e6b998dfbb0ebcac146b162b728d98db4fa3786aff24efb08b074",
    "/.allternit/wih/CM-UI002.wih.json": "29788ad6c2fbe763aa27d6f2aa95478fd25d1ee579303bb10cb23f64cdfc8219",
    "/spec/Deltas/0007-opencode-tui-fork.md": "13dd27f251b7b8be76adea10fa5ed952f81d5654ab768d1313c0c817d107dd1b",
    "/.allternit/wih/CM-K001.wih.json": "a36396bb6903c0edb20e894808888fe44d71700c5efcd30b5e8efaa96fc0a85f",
    "/spec/Contracts/BeadsGraph.schema.json": "85e30e98b1dcb68ebcabf5d51066a9890c77637776ae026dd846b9d6a38cfd47",
    "/.allternit/wih/CM-UI022.wih.json": "29d6827f616982ef169493859f45e061ed6c588bda5203c91fee58180506cde6",
    "/CODEBASE.md": "3f9cd3b83116ce73130c164d59fe7c5c5e6635d5d65e9dde6625d9efa7fdffba",
    "/.allternit/wih/T0013.wih.json": "25c17892009db0683415d648d57a836eace1b15dd3e0522143cf5b533f8687b8",
    "/.allternit/wih/CM-UI001.wih.json": "eaaefa018da07f64edab43d7dde2edbee1d479625ca2fecab3ae37bfccd9b4b6",
    "/.allternit/wih/CM-K031.wih.json": "1006e5c61557665adc84a126e446db966e2e8deb7c02b22f144c23476d994b0f",
    "/spec/Deltas/0006-task-parity-runstate.md": "7d0158b81828837e0fd702069098f6ce017ad7bf0b4fbd051648abc73fdf80ee",
    "/spec/Contracts/ToolRegistry.schema.json": "bb8c7bb377f33f3b6bca08a41fdd9308310303feca8e4da5974b81dc0a7257ae",
    "/.allternit/wih/CM-UI023.wih.json": "587e8dd85b1d840658e068faf39244cb8cbc2e7216113ee00d2a8dfbd4141431",
    "/.allternit/wih/CM-UI011.wih.json": "ff8d330944b40bc22425967d6aa4b4452ab84f05ef1185982ae2458122196049",
    "/agent/POLICY.md": "e198d05f77a670356be5af824f076ed1f78b7aefa42333570e6cd3b94e6b6ead",
    "/spec/ADRs/ADR-0000-template.md": "de744ffdf5b38bbf5d35de217efc47cb97fd697c3426fb2ede99899774df4b17",
    "/.allternit/wih/CM-UI040.wih.json": "efe319a9cf62567f28f44465765a908f6cc52680b3b148c3179f55f69e63d2b5",
    "/.allternit/graphs/graph-summit-mvp.json": "c2585cbd406ff4af8464e264449ff90dea48abd6c6cafd77216f9519a9140dde",
    "/.allternit/wih/CM-K050.wih.json": "c613526476368b9bd9ad7014ecd1cf554694a9347e8860dde7a8eedba1cd1ecb",
    "/.allternit/wih/CM-UI024.wih.json": "c3416a9b9e258d0a3e00d7e093ae59d29f51a6da736036103da6a32a12a8c6ff",
    "/.allternit/wih/CM-UI051.wih.json": "bf56a5ff055c48c2ea1c2c93d80c469c69477ace2fb86f225c6b017ce7670ff6",
    "/spec/Baseline.md": "37e51898f8e47b5f163ddb0cfd6bff1bde63b37fda04dbf28a8d11cc3afde83e",
    "/.allternit/wih/CM-UI003.wih.json": "28cfb9feba3f3a0557a91cafcdd8438a9db369d3ea5acf583d2b0e9585ef041b",
    "/spec/Contracts/BeadsRunState.schema.json": "0d2a0d8c0ffed8820ca89d4a4e65b6c0356780a351188135f33c8e798b4772ce",
    "/spec/Deltas/0004-contract-root-security-receipts.md": "23943f06b512eadb65338b62cf2550db1847338ac0fa4ed82dec25d098c95672",
    "/.allternit/graphs/graph-code-mode.json": "c257f34d201b10bccb55a4ebfddc28fe742d838711bada5a69fd656611f68ea6",
    "/spec/Contracts/Graph.schema.json": "827c96a3419ce56a1b05ca505c9ce2f8fbb4be016c3b9973f3f7b48ea2c03d0e",
    "/.allternit/wih/T0012.wih.json": "fcafaa278d7b2509c34eb9eb21b31c246b2e2cb0ca279a4e2a2ab6a08424bc64",
    "/tools/tool_registry.json": "10c3f5873d723ed022a390faba766faa8a8d2f764e109418dc04ca0975f3e4cf",
    "/.allternit/wih/CM-UI020.wih.json": "8f511b013c463dac6559f8c697a03b05c8d37e850d7d62d9b391166b5d63681f",
    "/.allternit/wih/CM-UI021.wih.json": "876991091298dc22acf9ed47b669446653bc8796ae92945f34ae1bbc47f4c5df",
    "/spec/Contracts/WIH.schema.json": "0973d69956de6d3382855ed7e63ff07de4d20d7e8e221b53fb3b83966faf78ff",
    "/spec/Contracts/Receipt.schema.json": "73bbae46d6aea764fdf8fe8a77a31ec9aefd8b18b728991d9a788172e96a5505"
  },
  "env": {
    "profile": "default"
  }
}